{
  "$schema": "https://json-schema.org/draft/2020-12/schema",
  "additionalProperties": false,
  "properties": {
    "kind": {
      "const": "projected_centered_unit_cube",
      "default": "projected_centered_unit_cube",
      "title": "Kind",
      "type": "string"
    },
    "order": {
      "const": "ccw_from_lexicographic_minimum",
      "default": "ccw_from_lexicographic_minimum",
      "title": "Order",
      "type": "string"
    },
    "schema_version": {
      "const": "1.0.0",
      "default": "1.0.0",
      "title": "Schema Version",
      "type": "string"
    },
    "signed_distance": {
      "const": "positive_inside_euclidean_edge_segments",
      "default": "positive_inside_euclidean_edge_segments",
      "title": "Signed Distance",
      "type": "string"
    },
    "vertices_uv": {
      "items": {
        "maxItems": 2,
        "minItems": 2,
        "prefixItems": [
          {
            "maximum": 1000000,
            "minimum": -1000000,
            "type": "number"
          },
          {
            "maximum": 1000000,
            "minimum": -1000000,
            "type": "number"
          }
        ],
        "type": "array"
      },
      "title": "Vertices Uv",
      "type": "array"
    }
  },
  "required": [
    "vertices_uv"
  ],
  "title": "WindowDefinition",
  "type": "object"
}
