{
  "kind": "projected_centered_unit_cube",
  "order": "ccw_from_lexicographic_minimum",
  "schema_version": "1.0.0",
  "signed_distance": "positive_inside_euclidean_edge_segments",
  "vertices_uv": [
    [
      -1.0233345472033855,
      1.942890293094024e-16
    ],
    [
      -0.8278950396185308,
      -0.6015009550075455
    ],
    [
      -0.3162277660168382,
      -0.9732489894677301
    ],
    [
      0.31622776601683766,
      -0.9732489894677301
    ],
    [
      0.8278950396185306,
      -0.6015009550075459
    ],
    [
      1.0233345472033855,
      -1.942890293094024e-16
    ],
    [
      0.8278950396185308,
      0.6015009550075455
    ],
    [
      0.3162277660168382,
      0.9732489894677301
    ],
    [
      -0.31622776601683766,
      0.9732489894677301
    ],
    [
      -0.8278950396185306,
      0.6015009550075459
    ]
  ]
}
